"Enabled","Activo"

"MercadoPago - Configuration", "MercadoPago - Configuración"
"Credit Card - MercadoPago","Tarjetas de crédito - MercadoPago"

"MercadoPago Custom - Credit Card","MercadoPago Custom - Tarjeta de Crédito"
"Payment Title","Título"
"Category of your store","Categoria de la tienda"
"Choose the status of approved orders","Elija el estado de los pedidos para pagos Aprobados"
"Choose the status of refunded orders","Elija el estado de los pedidos para pagos Devueltos"
"Choose the status when payment is pending","Elija el estado de los pedidos para pagos Pendientes"
"Choose the status when client open a mediation","Elija el estado de los pedidos para pagos en Disputa"
"Choose the status when payment was reject","Elija el estado de los pedidos para pagos Rechazados"
"Choose the status when payment was canceled","Elija el estado de los pedidos para pagos Cancelados"
"Checkout Position","Posición en el Checkout"
"To manage the status available go to System > Order Statuses","Para gerenciar los estados disponibles vaya a 'System > Order Statuses'"

"MercadoPago Custom - Ticket","MercadoPago Custom - Tickets de pago"

"MercadoPago Standard - Credit Card, Ticket and Account Money","MercadoPago Standard - Tarjetas, Tickets y Dinero en Cuenta"
"Country","País"
"Type Checkout","Tipo de Checkout"
"Auto Redirect","Auto-Redireccionar"
"Exclude Payment Methods","Excluir Medios de Pago"
"Maximum number of accepted installments","Numero maximo de cuotas"
"Width Checkout Iframe","Ancho de la zona del Checkout (Iframe)"
"Height Checkout Iframe","Alto de la zona del Checkout (Iframe)"
"Auto-redirect the buyer when finishing the payment.","Auto-Redireccionar al comprador al finalizar el pago."
"Select payment methods not accepted","Seleccione los medios de pago no aceptados"
"For the operation of the Checkout Custom Ticket is necessary to configure the Credentials 'CLIENT_ID' and 'CLIENT_SECRET' in 'MercadoPago - Configuration'","Para el funcionamento del Checkout Custom - Tickets de pago, es necesario configurar las Credenciales 'CLIENT_ID' y 'CLIENT_SECRET' en 'MercadoPago - Configuración'"
"For the operation of the Checkout Standard is necessary to configure the Credentials 'CLIENT_ID' and 'CLIENT_SECRET' in 'MercadoPago - Configuration'","Para el funcionamento del Checkout Standard, es necesario configurar las Credenciales 'CLIENT_ID' y 'CLIENT_SECRET' en 'MercadoPago - Configuración'"

"Card Number","Número de Tarjeta"
"Month","Mes"
"Year","Año"
"Card Holder Name","Titular de la Tarjeta"
"Document Number","Número de Documento"
"CVV","Código de Seguridad"
"Installments","Cuotas"
"Banks","Bancos"

"Enter the card number","Digite el número de tarjeta"
"Validating Data","Validando datos"
"An error has occurred. Please refresh the page.","Ocurrio un error. Por favor, actualice la página."
"Card number is invalid.","Número de Tarjeta inválido."
"CVV is invalid.","Código de Seguridad inválido."
"Card Holder Name is invalid.","Nombre de titular de tarjeta inválido."
"Document Number is invalid.","Número de Documento inválido."
"Document Type is invalid.","Tipo de Documento inválido."
"Year is invalid.","Año inválido."
"Month is invalid.","Mes inválido."
"Please validate your data.","Por favor, valide los datos"
"Cannot pay this amount with this payment_method_id.","No se puede pagar esta monto con este medio de pago."

"Card Number: %s","Número de Tarjeta: %s"
"Card Holder Name: %s","Titular de la Tarjeta: %s"
"Payment Method: %s","Medio de pago: %s"
"Expiration Date: %s","Fecha de Expiración: %s"
"Installments: %s","Cuotas: %s"
"Statement Descriptor: %s","Identificación en la Factura de la Tarjeta de Crédito: %s"
"Payment Id (MercadoPago): %s","Número de Pago (MercadoPago): %s"
"Payment Status: %s (%s)","Estado del Pago: %s (%s)"

"Click on the link to generate the ticket","Clique en el link para mostrar el ticket de pago"
"Generate Ticket","Generar ticket de pago"

"Payment Method","Medio de pago"

"Generate the ticket and pay it wherever you want.","Genere el ticket de pago y pague"
"Will be approved within 2 business days.","Será aprobado en hasta 2 días hábiles"



"Thank you for your purchase!","Gracias por su compra!"
"Your order %1 has been successfully generated.","Su pedido con el numero %1 fué generado con éxito."
"Done, your payment was accredited!","¡Listo, se acreditó tu pago!"
"We are processing the payment.","Estamos procesando el pago."
"In less than 2 business days we will tell you by e-mail if it is accredited or if we need more information.","Estamos procesando el pago. En menos de 2 días hábiles te avisaremos por e-mail si se acreditó o si necesitamos más información."
"In less than an hour we will send you by e-mail the result.","Estamos procesando el pago. En menos de una hora te avisaremos por e-mail el resultado."

"Check the card number.","Revisa el número de la tarjeta."
"Check the expiration date.","Revisa la fecha de vencimiento."
"Check the data.","Revisa los datos."
"Check the security code.","Revisa el código de seguridad."
"We could not process your payment.","No pudimos procesar tu pago."

"You must authorize to %s the payment of $ %s to MercadoPago.","Debes llamar y autorizar ante %s el pago de $ %s a MercadoPago"
"Call %s to activate your card.<br/>The phone is on the back of your card.","Llama a %s para que active tu tarjeta.<br/>El teléfono está al dorso de tu tarjeta."
"We could not process your payment.","No pudimos procesar tu pago."
"You already made a payment by that value.<br/>If you need to repay, use another card or other payment method.","Ya hiciste un pago por ese valor.<br/>Si necesitas volver a pagar usa otra tarjeta u otro medio de pago."
"Your payment was rejected.<br/>Choose another payment method, we recommend cash methods.","Tu pago fue rechazado.<br/>Elige otro de los medios de pago, te recomendamos con medios de pago en efectivo."
"Your %s do not have sufficient funds.","Tu %s no tiene fondos suficientes."
"%s does not process payments in %s installments.","%s no procesa pagos en %s cuotas."
"You have got to the limit of allowed attempts.<br/>Choose another card or another payment method.","Llegaste al límite de intentos permitidos.<br/>Elige otra tarjeta u otro medio de pago."
"%s did not process the payment.","%s no procesó el pago."

"You can not make payments to users in other countries.","No puedes realizar pagos a usuarios de otros países."
"Payment Method selected does not process payments in installments selected. Choose another card or another payment method.","El medio de pago seleccionado no procesa pagos en la cuota seleccionada. Elige otra tarjeta u otro medio de pago."
"We could not process your payment. Error code: 126.","No pudimos procesar tu pago. Código de error: 126."
"Payment Method selected does not process payments for the selected amount. Choose another card or another payment method.","El medio de pago seleccionado no procesa pagos del monto seleccionado. Elige otro medio de pago."
"We could not process your payment. Error code: 145.","No pudimos procesar tu pago. Código de error: 145"
"You can not make payments. Error code: 150.","No puedes realizar pagos. Código de error: 150."
"You can not make payments.","No puedes realizar pagos."
"We could not process your payment. Error code: 160.","No pudimos procesar tu pago. Código de error: 160."
"Payment Method selected is not available at this time. Choose another card or another payment method.","El medio de pago seleccionado no está disponible en este momento. Elige otra tarjeta u otro medio de pago."
"You made a similar payment moments ago. Try again in a few minutes.","Realizaste un pago similar hace instantes. Intenta nuevamente en unos minutos."
"We could not process your payment. %s","No pudimos procesar tu pago. %s"

"Verify the form data or wait until the validation of the payment data","Verifique los datos del formulario o aguarde la validación de los datos del pago."

"Automatic notification of the MercadoPago: The payment was approved.","Notificación automática de MercadoPago: El pago fué aprobado."
"Automatic notification of the MercadoPago: The payment was refunded.","Notificación automática de MercadoPago: El pago fué devuelto."
"Automatic notification of the MercadoPago: The payment is being processed.","Notificación automática de MercadoPago: El pago esta siendo procesado."
"Automatic notification of the MercadoPago: The payment is being processed. Will be approved within 2 business days.","Notificación automática de MercadoPago: El pago esta siendo procesado. Será aprobado en hasta 2 días hábiles."
"Automatic notification of the MercadoPago: The payment is in the process of Dispute, check the graphic account of the MercadoPago for more information.","Notificación automática de MercadoPago: El pago está en un proceso de disputa, chequea tu cuenta de MercadoPago para mayor información."
"Automatic notification of the MercadoPago: The payment was cancelled.","Notificación automática de MercadoPago: El pago fué cancelado."
"Automatic notification of the MercadoPago: The payment was rejected.","Notificación automática de MercadoPago: El pago fué rechazado."
"<br/> Payment id: %s","<br/> Número de Pago: %s"
"<br/> Status: %s","<br/> Estado: %s"
"<br/> Status Detail: %s","<br/> Detalle del Estado: %s"

"Get your public_key in the following address: https://www.mercadopago.com/mlb/account/credentials","Obtén tu public_key en la siguiente dirección: https://www.mercadopago.com/mla/account/credentials"
"Choose the status when payment was chargeback", "Elija el estado de los pedidos para pagos con status Chargeback"

"Cannot operate between users from different countries.","No es posible realizar pagos a usuarios de otros países."
"Payment method does not process installments.","El medio de pago no procesa pagos en cuotas. Elige otra tarjeta u otro medio de pago."
"Cannot pay this amount with this paymentMethod.","El medio de pago no procesa pagos del monto seleccionado. Elige otra tarjeta u otro medio de pago."
"You user cannot do payments currently","No puedes realizar pagos en este momento."
"You user cannot do payments currently with this payment method.","No puedes realizar pagos con este medio de pago en este momento."
"Unavailable paymentmethod currently.","El medio de pago no está disponible en este momento, elige otra tarjeta o medio de pago."
"Already posted the same request in the last minute.","Realizaste un pago similar hace instantes. Intenta nuevamente en unos minutos."
"Doesn't find a campaign with the given code.", "No se ha encontrado una campaña de descuento con el código indicado."
"We could not process your payment in this moment. Please check the form data and retry later","No es posible procesar su pago en este momento. Por favor verifique los datos ingresados y vuelva a intentarlo."

"The items Quantity has exceeded the limits. We could not process your payment.", "La cantidad de ítems ha excedido el límite. No es posible procesar su pago."
"Already posted the same request in the last minute.", "Realizaste un pago similar hace instantes. Intenta nuevamente en unos minutos."
"The transaction amount is invalid. We could not process your payment.", "El monto de la transacción es inválido. No es posible procesar su pago."
"You user cannot do payments currently", "No puedes realizar pagos en este momento."
"You have exceeded the max number of refunds for this payment.", "Has excedido el máximo número de devoluciones para este pago"
"Payment too old to be refunded", "El pago es demasiado antiguo para ser devuelto"
"Coupon code is invalid", "Código de cupón inválido"
"Your user e-mail does not exist. Please check data and retry later", "Tu dirección de e-mail no existe. Por favor verifique los datos ingresados y vuelva a intentarlo."
"You must provide your cardholder name with your card data", "Debes ingresar el titular de la tarjeta"
"Not found payment method or credit card. Please check the form data and retry.", "No se encontró el método de pago o tarjeta de crédito. Por favor verifique los datos ingresados y vuelva a intentarlo."
"Security code is invalid. Please check the form data and retry.", "El código de seguridad de la tarjeta no es válido. Por favor verifique los datos ingresados y vuelva a intentarlo."
"Security code is a required field. Please check the form data and retry.", "Debe ingresar el código de seguridad de la tarjeta. Por favor verifique los datos ingresados y vuelva a intentarlo."
"Payment method or credit card invalid. Please check the form data and retry.", "El método de pago o tarjeta de crédito son inválidos. Por favor verifique los datos ingresados y vuelva a intentarlo."
"Credit card number is invalid. Please check the form data and retry.", "El número de la tarjeta de crédito es inválido. Por favor verifique los datos ingresados y vuelva a intentarlo."
"Expiration month can not be empty. Please check the form data and retry.", "El mes de expiración de la tarjeta no puede estar vacío. Por favor verifique los datos ingresados y vuelva a intentarlo."
"Expiration year can not be empty. Please check the form data and retry.", "El año de expiración de la tarjeta no puede estar vacío. Por favor verifique los datos ingresados y vuelva a intentarlo."
"Cardholder name can not empty. Please check the form data and retry.", "El titular de la tarjeta no puede estar vacío. Por favor verifique los datos ingresados y vuelva a intentarlo."
"Cardholder document number can not be empty. Please check the form data and retry.", "Cardholder document number can not be empty. Por favor verifique los datos ingresados y vuelva a intentarlo."
"Cardholder document type can not be empty. Please check the form data and retry.", "El tipo de documento no puede estar vacío. Por favor verifique los datos ingresados y vuelva a intentarlo."
"Cardholder document subtype can not be empty. Please check the form data and retry.", "El subtipo de documento no puede estar vacío. Por favor verifique los datos ingresados y vuelva a intentarlo."
"Expiration month is invalid. Please check the form data and retry.", "El mes de expiración de la tarjeta es inválido. Por favor verifique los datos ingresados y vuelva a intentarlo."
"Expiration year is invalid. Please check the form data and retry.", "El año de expiración de la tarjeta es inválido. Por favor verifique los datos ingresados y vuelva a intentarlo."
"Installments attribute can not be empty. Please check the form data and retry.", "Debe ingresar la cantidad de cuotas del pago. Por favor verifique los datos ingresados y vuelva a intentarlo."
"Coupon amount is invalid. Please check the form data and retry.", "El monto de descuento es inválido. Por favor verifique los datos ingresados y vuelva a intentarlo."
"Doesn't find a campaign to amount given", "No se ha encontrado una campaña que coicida con el monto de la orden"
"Amount discount is invalid", "El monto de descuento no es válido"

"Use other card","Utilizar otra tarjeta"
"Return to cards list","Volver a lista de tarjetas"
"Mercado Pago - Classic Checkout: Invalid client id or client secret","Mercado Pago - Classic Checkout: El id de cliente o la clave secreta, son inválidas"
"Mercado Pago - Custom Checkout: Invalid access token", "Mercado Pago - Custom Checkout: El token de acceso es inválido"
"(estimated date %s)","(fecha estimada %s)"

"Cannot repeat Magento Product size attributes","No puede repetir los atributos de tamaño de producto de magento"
"Cannot repeat MercadoEnvios Product size attributes","No puede repetir los atributos de tamaño de producto de MercadoEnvios"
"Checkout Classic Method must be enabled","El método de pago Checkout Classic debe estar habilitado"
"MercadoEnvios is not enabled in the country where MercadoPago is configured", "MercadoEnvios no está disponible en el país configurado para MercadoPago"
"Discount MercadoPago","Descuento de MercadoPago"